{
  "$schema": "https://json-schema.org/draft/2020-12/schema",
  "$id": "https://agentic-workflow-kit.local/eval-kit/case-manifest.schema.json",
  "title": "EvalKitCaseManifest",
  "type": "object",
  "additionalProperties": true,
  "required": ["schema_version", "case_id", "artifacts"],
  "properties": {
    "schema_version": {
      "type": "string",
      "minLength": 1
    },
    "case_id": {
      "type": "string",
      "minLength": 1
    },
    "case_type": {
      "type": "string"
    },
    "artifacts": {
      "type": "array",
      "minItems": 1,
      "items": {
        "type": "object",
        "additionalProperties": false,
        "required": ["role", "path"],
        "properties": {
          "role": {
            "type": "string",
            "minLength": 1
          },
          "path": {
            "type": "string",
            "minLength": 1
          }
        }
      }
    },
    "metadata": {
      "type": "object"
    }
  }
}
